[
  {
    "character": "政",
    "level": "N3",
    "strokes": 9,
    "grade": 5,
    "freq": 17,
    "radical": "攴",
    "radical_number": 66,
    "onyomi": [
      "セイ",
      "ショウ"
    ],
    "kunyomi": [
      "まつりごと",
      "まん"
    ],
    "meanings": [
      "politics",
      "government"
    ],
    "nanori": [
      "ただ",
      "まさ"
    ],
    "words": [
      "政治",
      "政府",
      "政党",
      "行政",
      "財政",
      "政権",
      "政策"
    ]
  },
  {
    "character": "議",
    "level": "N3",
    "strokes": 20,
    "grade": 4,
    "freq": 25,
    "radical": "言",
    "radical_number": 149,
    "onyomi": [
      "ギ"
    ],
    "kunyomi": [],
    "meanings": [
      "deliberation",
      "consultation",
      "debate",
      "consideration"
    ],
    "nanori": [
      "かた",
      "のり"
    ],
    "words": [
      "会議",
      "会議室",
      "議員",
      "議会",
      "議長",
      "議論",
      "不思議",
      "異議"
    ]
  },
  {
    "character": "民",
    "level": "N3",
    "strokes": 5,
    "grade": 4,
    "freq": 28,
    "radical": "氏",
    "radical_number": 83,
    "onyomi": [
      "ミン"
    ],
    "kunyomi": [
      "たみ"
    ],
    "meanings": [
      "people",
      "nation",
      "subjects"
    ],
    "nanori": [
      "ひと",
      "み"
    ],
    "words": [
      "市民",
      "国民",
      "住民",
      "農民",
      "民間",
      "民謡",
      "移民",
      "庶民"
    ]
  },
  {
    "character": "連",
    "level": "N3",
    "strokes": 10,
    "grade": 4,
    "freq": 30,
    "radical": "辵",
    "radical_number": 162,
    "onyomi": [
      "レン"
    ],
    "kunyomi": [
      "つら.なる",
      "つら.ねる",
      "つ.れる",
      "-づ.れ"
    ],
    "meanings": [
      "take along",
      "lead",
      "join",
      "connect",
      "party",
      "gang",
      "clique"
    ],
    "nanori": [
      "ずれ",
      "つれ",
      "むらじ",
      "れ"
    ],
    "words": [
      "連絡",
      "連れる",
      "関連",
      "連れ",
      "連想",
      "連続",
      "連合",
      "一連"
    ]
  },
  {
    "character": "対",
    "level": "N3",
    "strokes": 7,
    "grade": 3,
    "freq": 34,
    "radical": "寸",
    "radical_number": 41,
    "onyomi": [
      "タイ",
      "ツイ"
    ],
    "kunyomi": [
      "あいて",
      "こた.える",
      "そろ.い",
      "つれあ.い",
      "なら.ぶ",
      "むか.う"
    ],
    "meanings": [
      "vis-a-vis",
      "opposite",
      "even",
      "equal",
      "versus",
      "anti-",
      "compare"
    ],
    "nanori": [
      "つし"
    ],
    "words": [
      "反対",
      "対",
      "絶対",
      "対象",
      "対する",
      "応対",
      "対策",
      "対照"
    ]
  },
  {
    "character": "部",
    "level": "N3",
    "strokes": 11,
    "grade": 3,
    "freq": 36,
    "radical": "邑",
    "radical_number": 163,
    "onyomi": [
      "ブ"
    ],
    "kunyomi": [
      "-べ"
    ],
    "meanings": [
      "section",
      "bureau",
      "dept",
      "class",
      "copy",
      "part",
      "portion",
      "counter for copies of a newspaper or magazine"
    ],
    "nanori": [
      "とり",
      "ふ",
      "ぺ",
      "ま"
    ],
    "words": [
      "全部",
      "部屋",
      "部長",
      "部分",
      "大部分",
      "外部",
      "学部",
      "部首"
    ]
  },
  {
    "character": "合",
    "level": "N3",
    "strokes": 6,
    "grade": 2,
    "freq": 41,
    "radical": "口",
    "radical_number": 30,
    "onyomi": [
      "ゴウ",
      "ガッ",
      "カッ"
    ],
    "kunyomi": [
      "あ.う",
      "-あ.う",
      "あ.い",
      "あい-",
      "-あ.い",
      "-あい",
      "あ.わす",
      "あ.わせる",
      "-あ.わせる"
    ],
    "meanings": [
      "fit",
      "suit",
      "join",
      "0.1"
    ],
    "nanori": [
      "あう",
      "あん",
      "い",
      "か",
      "こう",
      "ごお",
      "に",
      "ね",
      "や",
      "わい"
    ],
    "words": [
      "合う",
      "具合",
      "試合",
      "都合",
      "場合",
      "割合",
      "間に合う",
      "合図"
    ]
  },
  {
    "character": "市",
    "level": "N3",
    "strokes": 5,
    "grade": 2,
    "freq": 42,
    "radical": "巾",
    "radical_number": 50,
    "onyomi": [
      "シ"
    ],
    "kunyomi": [
      "いち"
    ],
    "meanings": [
      "market",
      "city",
      "town"
    ],
    "nanori": [
      "い",
      "ち"
    ],
    "words": [
      "市",
      "市民",
      "市場",
      "都市",
      "市街"
    ]
  },
  {
    "character": "内",
    "level": "N3",
    "strokes": 4,
    "grade": 2,
    "freq": 44,
    "radical": "冂",
    "radical_number": 13,
    "onyomi": [
      "ナイ",
      "ダイ"
    ],
    "kunyomi": [
      "うち"
    ],
    "meanings": [
      "inside",
      "within",
      "between",
      "among",
      "house",
      "home"
    ],
    "nanori": [
      "いと",
      "ただ",
      "ち",
      "のち"
    ],
    "words": [
      "案内",
      "以内",
      "家内",
      "内容",
      "内科",
      "内線",
      "内訳",
      "内閣"
    ]
  },
  {
    "character": "相",
    "level": "N3",
    "strokes": 9,
    "grade": 3,
    "freq": 45,
    "radical": "目",
    "radical_number": 109,
    "onyomi": [
      "ソウ",
      "ショウ"
    ],
    "kunyomi": [
      "あい-"
    ],
    "meanings": [
      "inter-",
      "mutual",
      "together",
      "each other",
      "minister of state",
      "councillor",
      "aspect",
      "phase",
      "physiognomy"
    ],
    "nanori": [
      "あ",
      "い",
      "おう",
      "さ",
      "さが",
      "すけ"
    ],
    "words": [
      "相談",
      "相手",
      "首相",
      "相続",
      "相当",
      "相撲",
      "相違",
      "相互"
    ]
  },
  {
    "character": "定",
    "level": "N3",
    "strokes": 8,
    "grade": 3,
    "freq": 48,
    "radical": "宀",
    "radical_number": 40,
    "onyomi": [
      "テイ",
      "ジョウ"
    ],
    "kunyomi": [
      "さだ.める",
      "さだ.まる",
      "さだ.か"
    ],
    "meanings": [
      "determine",
      "fix",
      "establish",
      "decide"
    ],
    "nanori": [
      "さた"
    ],
    "words": [
      "予定",
      "安定",
      "勘定",
      "決定",
      "定期",
      "否定",
      "一定",
      "仮定"
    ]
  },
  {
    "character": "回",
    "level": "N3",
    "strokes": 6,
    "grade": 2,
    "freq": 50,
    "radical": "囗",
    "radical_number": 31,
    "onyomi": [
      "カイ",
      "エ"
    ],
    "kunyomi": [
      "まわ.る",
      "-まわ.る",
      "-まわ.り",
      "まわ.す",
      "-まわ.す",
      "まわ.し-",
      "-まわ.し",
      "もとお.る",
      "か.える"
    ],
    "meanings": [
      "-times",
      "round",
      "game",
      "revolve",
      "counter for occurrences"
    ],
    "words": [
      "回る",
      "回",
      "回復",
      "今回",
      "回す",
      "回り",
      "回数",
      "回転"
    ]
  },
  {
    "character": "選",
    "level": "N3",
    "strokes": 15,
    "grade": 4,
    "freq": 57,
    "radical": "辵",
    "radical_number": 162,
    "onyomi": [
      "セン"
    ],
    "kunyomi": [
      "えら.ぶ",
      "え.る",
      "よ.る"
    ],
    "meanings": [
      "elect",
      "select",
      "choose",
      "prefer"
    ],
    "words": [
      "選ぶ",
      "選手",
      "選択",
      "選挙",
      "選考",
      "抽選",
      "当選"
    ]
  },
  {
    "character": "米",
    "level": "N3",
    "strokes": 6,
    "grade": 2,
    "freq": 61,
    "radical": "米",
    "radical_number": 119,
    "onyomi": [
      "ベイ",
      "マイ",
      "メエトル"
    ],
    "kunyomi": [
      "こめ",
      "よね"
    ],
    "meanings": [
      "rice",
      "USA",
      "metre"
    ],
    "nanori": [
      "は",
      "べ",
      "まべ",
      "め",
      "よ",
      "よな",
      "よの",
      "よま"
    ],
    "words": [
      "米",
      "欧米",
      "南米"
    ]
  },
  {
    "character": "実",
    "level": "N3",
    "strokes": 8,
    "grade": 3,
    "freq": 68,
    "radical": "宀",
    "radical_number": 40,
    "onyomi": [
      "ジツ",
      "シツ"
    ],
    "kunyomi": [
      "み",
      "みの.る",
      "まこと",
      "みの",
      "みち.る"
    ],
    "meanings": [
      "reality",
      "truth",
      "seed",
      "fruit",
      "nut"
    ],
    "nanori": [
      "ぐみ",
      "さね"
    ],
    "words": [
      "実",
      "確実",
      "現実",
      "事実",
      "実験",
      "実現",
      "実行",
      "実際"
    ]
  },
  {
    "character": "関",
    "level": "N3",
    "strokes": 14,
    "grade": 4,
    "freq": 70,
    "radical": "門",
    "radical_number": 169,
    "onyomi": [
      "カン"
    ],
    "kunyomi": [
      "せき",
      "-ぜき",
      "かか.わる",
      "からくり",
      "かんぬき"
    ],
    "meanings": [
      "connection",
      "barrier",
      "gateway",
      "involve",
      "concerning"
    ],
    "words": [
      "玄関",
      "関係",
      "関心",
      "関連",
      "機関",
      "関する",
      "関西",
      "関東"
    ]
  },
  {
    "character": "決",
    "level": "N3",
    "strokes": 7,
    "grade": 3,
    "freq": 71,
    "radical": "水",
    "radical_number": 85,
    "onyomi": [
      "ケツ"
    ],
    "kunyomi": [
      "き.める",
      "-ぎ.め",
      "き.まる",
      "さ.く"
    ],
    "meanings": [
      "decide",
      "fix",
      "agree upon",
      "appoint"
    ],
    "words": [
      "決まる",
      "決める",
      "決して",
      "解決",
      "決心",
      "決定",
      "決まり",
      "可決"
    ]
  },
  {
    "character": "全",
    "level": "N3",
    "strokes": 6,
    "grade": 3,
    "freq": 75,
    "radical": "入",
    "radical_number": 11,
    "onyomi": [
      "ゼン"
    ],
    "kunyomi": [
      "まった.く",
      "すべ.て"
    ],
    "meanings": [
      "whole",
      "entire",
      "all",
      "complete",
      "fulfill"
    ],
    "nanori": [
      "たけ",
      "まさ"
    ],
    "words": [
      "全部",
      "安全",
      "全",
      "完全",
      "全て",
      "全員",
      "全国",
      "全体"
    ]
  },
  {
    "character": "表",
    "level": "N3",
    "strokes": 8,
    "grade": 3,
    "freq": 77,
    "radical": "衣",
    "radical_number": 145,
    "onyomi": [
      "ヒョウ"
    ],
    "kunyomi": [
      "おもて",
      "-おもて",
      "あらわ.す",
      "あらわ.れる",
      "あら.わす"
    ],
    "meanings": [
      "surface",
      "table",
      "chart",
      "diagram"
    ],
    "words": [
      "表",
      "表す",
      "代表",
      "発表",
      "表現",
      "表情",
      "表面",
      "公表"
    ]
  },
  {
    "character": "戦",
    "level": "N3",
    "strokes": 13,
    "grade": 4,
    "freq": 78,
    "radical": "戈",